{
  "site": "https://shannon.forge.solutiosoftware.com",
  "source": "SH-Emporia School Menu & Content.pdf",
  "generated": "2026-06-15",
  "menus": {
    "mainmenu": [
      {
        "title": "About Sacred Heart School",
        "type": "heading",
        "children": [
          {
            "title": "Welcome from the Principal",
            "type": "single_article",
            "category": "Page Content",
            "content_source": "generate",
            "notes": "Principal is retiring — generate new content"
          },
          {
            "title": "Why Choose Sacred Heart?",
            "type": "single_article",
            "category": "Page Content",
            "content_source": "pull"
          },
          {
            "title": "Faculty & Staff",
            "type": "category_grid",
            "category": "Faculty & Staff",
            "content_source": "none",
            "notes": "Staff grid — contentarray particle; no teacher subpages; updated info and pictures to be sent during design phase"
          },
          {
            "title": "Our History",
            "type": "single_article",
            "category": "Page Content",
            "content_source": "pull"
          },
          {
            "title": "Contact Us & Directions",
            "type": "single_article",
            "category": "Page Content",
            "content_source": "pull"
          },
          {
            "title": "Sacred Heart School Commission",
            "type": "single_article",
            "category": "Page Content",
            "content_source": "pull"
          },
          {
            "title": "Alumni",
            "type": "single_article",
            "category": "Page Content",
            "content_source": "pull"
          }
        ]
      },
      {
        "title": "News & Events",
        "type": "heading",
        "children": [
          {
            "title": "Calendar",
            "type": "single_article",
            "category": "News & Events",
            "content_source": "pull",
            "notes": "Include Academic calendar year view"
          },
          {
            "title": "Weekly Information & Newsletter",
            "type": "single_article",
            "category": "News & Events",
            "content_source": "pull"
          },
          {
            "title": "Lunch Menu",
            "type": "single_article",
            "category": "News & Events",
            "content_source": "pull"
          },
          {
            "title": "Parish News",
            "type": "external_url",
            "target": "https://shemporia.org",
            "content_source": "redirect",
            "notes": "Links to church website; not a grid tile"
          }
        ]
      },
      {
        "title": "Admissions & Academics",
        "type": "heading",
        "children": [
          {
            "title": "Request Information",
            "type": "single_article",
            "category": "Page Content",
            "content_source": "pull"
          },
          {
            "title": "Registration",
            "type": "single_article",
            "category": "Page Content",
            "content_source": "pull"
          },
          {
            "title": "Financial Aid & Tuition",
            "type": "single_article",
            "category": "Page Content",
            "content_source": "pull"
          },
          {
            "title": "Curriculum",
            "type": "single_article",
            "category": "Page Content",
            "content_source": "pull"
          },
          {
            "title": "Specials",
            "type": "single_article",
            "category": "Page Content",
            "content_source": "pull"
          },
          {
            "title": "Preschool & Child Care Center",
            "type": "single_article",
            "category": "Page Content",
            "content_source": "pull"
          },
          {
            "title": "Accreditations",
            "type": "single_article",
            "category": "Page Content",
            "content_source": "pull"
          },
          {
            "title": "KSDE Accountability Reports",
            "type": "single_article",
            "category": "Page Content",
            "content_source": "pull"
          }
        ]
      },
      {
        "title": "Parents",
        "type": "heading",
        "children": [
          {
            "title": "Parent Login",
            "type": "single_article",
            "category": "Parents",
            "content_source": "pull",
            "notes": "Confirm: internal Joomla login page or external portal redirect (e.g. FACTS Family)?"
          },
          {
            "title": "Parent/Student Handbook",
            "type": "single_article",
            "category": "Parents",
            "content_source": "pull"
          },
          {
            "title": "Calendar",
            "type": "alias",
            "notes": "Alias of News & Events > Calendar — same page in two locations; not a grid tile"
          },
          {
            "title": "Lunch Menus & Information",
            "type": "single_article",
            "category": "Parents",
            "content_source": "pull",
            "notes": "Include wellness policy and application for free/reduced lunch"
          },
          {
            "title": "Virtus",
            "type": "single_article",
            "category": "Parents",
            "content_source": "pull"
          },
          {
            "title": "PTO",
            "type": "single_article",
            "category": "Parents",
            "content_source": "pull",
            "notes": "Convert to one page"
          },
          {
            "title": "Extended Care",
            "type": "single_article",
            "category": "Parents",
            "content_source": "pull"
          },
          {
            "title": "Dress Code",
            "type": "single_article",
            "category": "Parents",
            "content_source": "pull"
          },
          {
            "title": "Pick Up/Drop Off",
            "type": "single_article",
            "category": "Parents",
            "content_source": "pull"
          },
          {
            "title": "Supply Lists",
            "type": "single_article",
            "category": "Parents",
            "content_source": "pull"
          }
        ]
      },
      {
        "title": "Support Us",
        "type": "heading",
        "children": [
          {
            "title": "Donate",
            "type": "single_article",
            "category": "Page Content",
            "content_source": "pull"
          },
          {
            "title": "Mexican Supper",
            "type": "single_article",
            "category": "Page Content",
            "content_source": "pull"
          },
          {
            "title": "Feast for Our Future",
            "type": "single_article",
            "category": "Page Content",
            "content_source": "pull"
          }
        ]
      },
      {
        "title": "Capital Campaign",
        "type": "external_url",
        "target": "https://shemporia.org/donate/school-capital-campaign",
        "content_source": "redirect"
      },
      {
        "title": "Sponsors",
        "type": "single_article",
        "category": "Page Content",
        "content_source": "none",
        "notes": "No children or content source in PDF — confirm: sponsor grid, placeholder, or content to pull?"
      }
    ],
    "hiddenmenu": [
      {
        "title": "Church",
        "type": "external_url",
        "target": "https://shemporia.org",
        "content_source": "redirect",
        "notes": "Used by Under Rotator 'Church' quicklink, Parish News, and Capital Campaign"
      }
    ]
  },
  "modules": {
    "under_rotator": {
      "items": [
        {
          "label": "Schedule a Tour",
          "menu_item": "Request Information",
          "notes": "Points to Admissions & Academics > Request Information; form to be added to that page later"
        },
        {
          "label": "Preschool & Child Care",
          "menu_item": "Preschool & Child Care Center",
          "notes": "Points to Admissions & Academics > Preschool & Child Care Center"
        },
        {
          "label": "Parent Resources",
          "menu_item": "Parents",
          "notes": "Points to the Parents section landing page (category grid)"
        },
        {
          "label": "Parents Login",
          "menu_item": "Parent Login",
          "notes": "Points to Parents > Parent Login"
        },
        {
          "label": "Church",
          "menu_item": "Church",
          "notes": "Points to hiddenmenu Church — https://shemporia.org"
        }
      ]
    }
  },
  "grids": [
    {
      "page": "News & Events",
      "menu_ref": "News & Events",
      "type": "category_grid",
      "category": "News & Events",
      "particle": "joomla_articles",
      "member_menu_items": "listed",
      "notes": "Section landing page grid — Calendar, Weekly Newsletter, Lunch Menu articles; Parish News is an external link (not a grid tile)"
    },
    {
      "page": "Faculty & Staff",
      "menu_ref": "Faculty & Staff",
      "type": "category_grid",
      "category": "Faculty & Staff",
      "particle": "contentarray",
      "member_menu_items": "none",
      "notes": "Staff grid — individual staff as contentarray items; no per-staff menu items or teacher subpages"
    },
    {
      "page": "Parents",
      "menu_ref": "Parents",
      "type": "category_grid",
      "category": "Parents",
      "particle": "joomla_articles",
      "member_menu_items": "listed",
      "notes": "Landing page for the Parents section — all single_article children also have their own submenu items; Calendar alias is not a grid tile"
    }
  ],
  "open_questions": [